<?xml version="1.0"?>
<!--
  Copyright Â© Magento, Inc. All rights reserved.
  See COPYING.txt for license details.
  -->
<config xmlns:xsi="http://www.w3.org/2001/XMLSchema-instance" xsi:noNamespaceSchemaLocation="urn:magento:module:Magento_GraphQl:etc/graphql.xsd">
    <type xsi:type="OutputType" name="DownloadableProduct">
        <implements interface="ProductInterface" copyFields="true"/>
        <field xsi:type="ObjectArrayOutputField" name="downloadable_product_samples" itemType="DownloadableProductSamples"/>
        <field xsi:type="ObjectArrayOutputField" name="downloadable_product_links" itemType="DownloadableProductLinks"/>
        <field xsi:type="ObjectOutputField" name="links_purchased_separately" type="Int"/>
        <field xsi:type="ObjectOutputField" name="links_title" type="String"/>
        <!-- INVESTIGATE CUSTOM ATTRIBUTES WHY ARE NOT BEING ADDED AUTOMATICALLY -->
        <field xsi:type="ObjectOutputField" name="color" type="Int"/>
        <field xsi:type="ObjectOutputField" name="size" type="String"/>
        <field xsi:type="ObjectOutputField" name="manufacturer" type="Int"/>
    </type>
    <type xsi:type="OutputType" name="DownloadableProductSamples">
        <field xsi:type="ObjectOutputField" name="id" type="Int"/>
        <field xsi:type="ObjectOutputField" name="title" type="String"/>
        <field xsi:type="ObjectOutputField" name="sort_order" type="Int"/>
        <field xsi:type="ObjectOutputField" name="sample_type" type="DownloadableFileTypeEnum"/>
        <field xsi:type="ObjectOutputField" name="sample_file" type="String"/>
        <field xsi:type="ObjectOutputField" name="sample_url" type="String"/>
    </type>
    <type xsi:type="OutputType" name="DownloadableProductLinks">
        <field xsi:type="ObjectOutputField" name="id" type="Int"/>
        <field xsi:type="ObjectOutputField" name="title" type="String"/>
        <field xsi:type="ObjectOutputField" name="sort_order" type="Int"/>
        <field xsi:type="ObjectOutputField" name="is_shareable" type="Boolean"/>
        <field xsi:type="ObjectOutputField" name="price" type="Float"/>
        <field xsi:type="ObjectOutputField" name="number_of_downloads" type="Int"/>
        <field xsi:type="ObjectOutputField" name="link_type" type="DownloadableFileTypeEnum"/>
        <field xsi:type="ObjectOutputField" name="sample_type" type="DownloadableFileTypeEnum"/>
        <field xsi:type="ObjectOutputField" name="sample_file" type="String"/>
        <field xsi:type="ObjectOutputField" name="sample_url" type="String"/>
    </type>
    <type xsi:type="Enum" name="DownloadableFileTypeEnum">
        <item name="file">FILE</item>
        <item name="url">URL</item>
    </type>
</config>
