<?xml version="1.0"?>
<!--
  Copyright Â© Magento, Inc. All rights reserved.
  See COPYING.txt for license details.
  -->
<config xmlns:xsi="http://www.w3.org/2001/XMLSchema-instance" xsi:noNamespaceSchemaLocation="urn:magento:module:Magento_GraphQl:etc/graphql.xsd">
    <type xsi:type="OutputInterface" name="ProductInterface">
        <field xsi:type="ScalarOutputField" name="tax_class_id" type="Int" description="An ID assigned to a tax class. "/>
    </type>
    <type xsi:type="InputType" name="ProductFilterInput">
        <field xsi:type="ObjectInputField" name="tax_class_id" type="FilterTypeInput" description="An ID assigned to a tax class."/>
    </type>
    <type xsi:type="InputType" name="ProductSortInput">
        <field xsi:type="ObjectInputField" name="tax_class_id" type="SortEnum" description="An ID assigned to a tax class."/>
    </type>
    <type xsi:type="Enum" name="PriceAdjustmentCodesEnum">
        <item name="tax">TAX</item>
    </type>
</config>
