<?xml version="1.0"?>
<!--
  Copyright Â© Magento, Inc. All rights reserved.
  See COPYING.txt for license details.
  -->
<config xmlns:xsi="http://www.w3.org/2001/XMLSchema-instance" xsi:noNamespaceSchemaLocation="urn:magento:module:Magento_GraphQl:etc/graphql.xsd">
    <type xsi:type="OutputType" name="Query">
        <field xsi:type="ScalarOutputField" name="mergedField" type="Int" description="test field description" resolver="testResolverPath">
            <argument xsi:type="ScalarArgument" name="mergedArgument" type="String" description="test argument description"/>
        </field>
    </type>
    <type xsi:type="Enum" name="PriceAdjustmentDescriptionEnum">
        <item name="included">INCLUDED</item>
        <item name="excluded">EXCLUDED</item>
        <item name="mergedItem">MERGEDITEM</item>
    </type>
    <type xsi:type="OutputType" name="ProductLinks">
        <implements interface="MergedInterface" copyFields="true"/>
    </type>
    <type xsi:type="OutputInterface" name="MergedInterface" typeResolver="resolverPath">
        <field xsi:type="ScalarOutputField" name="mergedFieldN" type="String" description="The identifier of the linked merged product"/>
    </type>
</config>


